### ISSUE TITLE
X-Auth-Request-Groups headers to single header not working

### ISSUE THREAD

**Issue by gabrielrotaru** [oauth2-proxy/oauth2-proxy#1017]
Hello Guys,

Thanks a lot for your effort. I tried to test this relase v7.0.0 but this bug for me wasn't fixed. Maybe i'm doing something wrong.
I made the intergration with keycloak and rundeck. Keaycloak it's integrated with ldap and i mapped the groups.

Here is evaluation of the Token.
{
  "realm_access": {
    "roles": [
      "offline_access",
      "uma_authorization"
    ]
  },
  "resource_access": {
    "account": {
      "roles": [
        "manage-account",
        "manage-account-links",
        "view-profile"
      ]
    }
  },
  "scope": "openid email profile",
  "email_verified": true,
  "name": "Gabriel Stefan",
  "groups": [
    "Cust-Team-Test1",
    "Cust-Team-Test2",
    "Cust-Team-Test3",
    "Cust-Team-Test4"
  ],
  "preferred_username": "qqqq5555",
  "given_name": "Gabriel",
  "family_name": "Stefan",
  "email": "gabriel.stefan@test.com"
}

In Oauth in the log:
127.0.0.1:54820 - gabriel.stefan@test.com [2021/01/28 12:48:07] [AuthSuccess] Authenticated via OAuth2: Session{email:gabriel.stefan@test.com user:35dabf13-2641-4489-8740-417eab0a67b9 PreferredUsername:qqqq5555 token:true id_token:true created:2021-01-28 12:48:07.151380145 +0100 CET m=+91.954623590 expires:2021-01-28 12:53:07.144340139 +0100 CET m=+391.947583622 refresh_token:true groups:[Cust-Team-Test1 Cust-Team-Test2 Cust-Team-Test3 Cust-Team-Test4]}

Capture: 
Frame 18: 585 bytes on wire (4680 bits), 585 bytes captured (4680 bits)
Ethernet II, Src: 00:00:00_00:00:00 (00:00:00:00:00:00), Dst: 00:00:00_00:00:00 (00:00:00:00:00:00)
Internet Protocol Version 4, Src: 127.0.0.1, Dst: 127.0.0.1
Transmission Control Protocol, Src Port: 3000, Dst Port: 54396, Seq: 1, Ack: 4951, Len: 531
Hypertext Transfer Protocol
    HTTP/1.0 202 Accepted\r\n
    X-Auth-Request-Email: gabriel.stefan@test.com\r\n
    X-Auth-Request-Groups: Cust-Team-Test1\r\n
    X-Auth-Request-Groups: Cust-Team-Test2\r\n
    X-Auth-Request-Groups: Cust-Team-Test3\r\n
    X-Auth-Request-Groups: Cust-Team-Test4\r\n
    X-Auth-Request-Preferred-Username: qqqq5555\r\n
    X-Auth-Request-User: 35dabf13-2641-4489-8740-417eab0a67b9\r\n
    Date: Thu, 28 Jan 2021 11:30:50 GMT\r\n
    Content-Length: 0\r\n
    \r\n
    [HTTP response 1/1]
    [Time since request: 0.000689000 seconds]
    [Request in frame: 16]

Endpoint at rundeck server:
Frame 26: 5091 bytes on wire (40728 bits), 5091 bytes captured (40728 bits)
Ethernet II, Src: 00:00:00_00:00:00 (00:00:00:00:00:00), Dst: 00:00:00_00:00:00 (00:00:00:00:00:00)
Internet Protocol Version 4, Src: 127.0.0.1, Dst: 127.0.0.1
Transmission Control Protocol, Src Port: 61456, Dst Port: 4440, Seq: 1, Ack: 1, Len: 5037
Hypertext Transfer Protocol
    GET / HTTP/1.0\r\n
    Host: rundeck-cloud.local\r\n
    X-Forwarded-Proto: https\r\n
    X-Forwarded-User: qqqq5555\r\n
    X-Forwarded-Roles: Cust-Team-Test1\r\n
    X-Email: gabriel.stefan@test.com\r\n
    Connection: close\r\n
    User-Agent: Mozilla/5.0 (Windows NT 6.1; Win64; x64; rv:84.0) Gecko/20100101 Firefox/84.0\r\n
    Accept: text/html,application/xhtml+xml,application/xml;q=0.9,image/webp,*/*;q=0.8\r\n
    Accept-Language: en-US,en;q=0.5\r\n

Basically my expectation was to have X-Forwarded-Roles: Cust-Team-Test1,Cust-Team-Test2,Cust-Team-Test3,Cust-Team-Test4

Nginx  Version:  nginx/1.18.0
Part of nginx conf:
                        auth_request_set $user   $upstream_http_x_auth_request_preferred_username;
			auth_request_set $email  $upstream_http_x_auth_request_email;
                        auth_request_set $groups  $upstream_http_x_auth_request_groups;
			auth_request_set $auth_cookie $upstream_http_set_cookie;
			proxy_set_header X-Forwarded-User  $user;
                        proxy_set_header X-Forwarded-Roles  $groups;
			proxy_set_header X-Email $email;

BR,
Gabriel

_Originally posted by @gabrielrotaru in https://github.com/oauth2-proxy/oauth2-proxy/issues/799#issuecomment-769015379_

**Comment by NickMeves** [comment]
Hmmm - I did not expect to see the response headers that are array based still split and no comma delimited 🤔 

```
X-Auth-Request-Groups: Cust-Team-Test1\r\n
X-Auth-Request-Groups: Cust-Team-Test2\r\n
X-Auth-Request-Groups: Cust-Team-Test3\r\n
X-Auth-Request-Groups: Cust-Team-Test4\r\n
```

**Comment by gabrielrotaru** [comment]
Hi Nick,

Yes i'm also not understanding why still split. Based on your code InjectResponseHeaders functions trigger flattenHeaders and at the end header with same name should be concatenated (here i'm not so sure because i don't know go lang). Could you please tell me where are you processing the output of function getXAuthRequestHeaders().  From my understanding this function will parse the token and will return header by header. But i could not understand where the header with same name it's concatenated.
func getXAuthRequestHeaders() []Header {
        headers := []Header{
                {
                        Name: "X-Auth-Request-User",
                        Values: []HeaderValue{
                                {
                                        ClaimSource: &ClaimSource{
                                                Claim: "user",
                                        },
                                },
                        },
                },
                {
                        Name: "X-Auth-Request-Email",
                        Values: []HeaderValue{
                                {
                                        ClaimSource: &ClaimSource{
                                                Claim: "email",
                                        },
                                },
                        },
                },
                {
                        Name: "X-Auth-Request-Preferred-Username",
                        Values: []HeaderValue{
                                {
                                        ClaimSource: &ClaimSource{
                                                Claim: "preferred_username",
                                        },
                                },
                        },
                },
                {
                        Name: "X-Auth-Request-Groups",
                        Values: []HeaderValue{
                                {
                                        ClaimSource: &ClaimSource{
                                                Claim: "groups",
                                        },
                                },
                        },
                },
        }

        return headers
}

**Comment by NickMeves** [comment]
Here's the PR that should've had this change: https://github.com/oauth2-proxy/oauth2-proxy/pull/799

I'll look through the code to see if I can spot why this bug is occurring.

**Comment by NickMeves** [comment]
I see the bug -- the `req.Header` is passed in incorrectly instead of the `rw.Header()` in `injectResponseHeaders`: https://github.com/oauth2-proxy/oauth2-proxy/blob/b541805dc1a7ab0dceba9959a31e4c7a06c7c6cf/pkg/middleware/headers.go#L111

**Comment by gabrielrotaru** [comment]
Thanks a lot Nick,

I can confirm the issue was solved.

Frame 382: 465 bytes on wire (3720 bits), 465 bytes captured (3720 bits)
Ethernet II, Src: 00:00:00_00:00:00 (00:00:00:00:00:00), Dst: 00:00:00_00:00:00 (00:00:00:00:00:00)
Internet Protocol Version 4, Src: 127.0.0.1, Dst: 127.0.0.1
Transmission Control Protocol, Src Port: 3000, Dst Port: 56390, Seq: 1, Ack: 5149, Len: 411
Hypertext Transfer Protocol
    HTTP/1.0 202 Accepted\r\n
    X-Auth-Request-Email: gabriel.stefan@test.com\r\n
    X-Auth-Request-Groups: Cust-Team-Test1,Cust-Team-Test2,Cust-Team-Test3,Cust-Team-Test4\r\n
    X-Auth-Request-Preferred-Username: qqqq5555\r\n
    X-Auth-Request-User: 35dabf13-2641-4489-8740-417eab0a67b9\r\n
    Date: Thu, 04 Feb 2021 08:57:11 GMT\r\n
    Content-Length: 0\r\n
    \r\n
    [HTTP response 1/2]
    [Next request in frame: 385]

Auth it's working as expected now.
Another remark, this change i guess should be done also in func injectRequestHeader.

Have a nice day !

**Comment by NickMeves** [comment]
Thanks for confirming the fix! Appreciate the report and testing!
